{
  "opencrs": "0.1",
  "publisher": "conf.example",
  "updated_at": "2026-10-20T09:00:00+11:00",
  "expires_at": "2027-06-30T00:00:00+10:00",
  "networks": [
    {
      "id": "n",
      "name": "Strictest network",
      "formats": [
        {
          "id": "f",
          "pixels": [
            1000,
            2000
          ],
          "physical_mm": [
            1000,
            2000
          ],
          "media": {
            "static": [
              "image/png"
            ],
            "motion": [
              "video/mp4"
            ],
            "max_bytes": 1000,
            "fps": 30,
            "slot_s": 10
          },
          "rules": {
            "restricted_categories": [
              "IAB7"
            ],
            "motion": {
              "max_flash_hz": 3,
              "min_frame_hold_s": 0.5
            },
            "brightness": {
              "max_night_cd_m2": 300
            },
            "playback": {
              "min_dwell_s": 4,
              "max_transition_s": 1
            }
          }
        }
      ],
      "screens": [
        {
          "id": "A",
          "format": "f",
          "viewing": {
            "dwell_s": 4
          }
        },
        {
          "id": "B",
          "format": "f",
          "overrides": {
            "media": {
              "static": [
                "image/png"
              ],
              "motion": [
                "video/mp4"
              ],
              "max_bytes": 600,
              "fps": 25
            }
          },
          "rules": {
            "max_words": 5,
            "restricted_categories": [
              "IAB8"
            ],
            "motion": {
              "max_flash_hz": 2,
              "min_frame_hold_s": 1
            },
            "brightness": {
              "max_night_cd_m2": 200
            },
            "playback": {
              "min_dwell_s": 6,
              "max_transition_s": 0.5
            }
          }
        },
        {
          "id": "C",
          "format": "f",
          "viewing": {
            "dwell_s": 2
          }
        }
      ]
    }
  ]
}
