{
  "opencrs": "0.1",
  "publisher": "conf.example",
  "updated_at": "2026-10-20T09:00:00+11:00",
  "expires_at": "2027-06-30T00:00:00+10:00",
  "networks": [
    {
      "id": "road",
      "name": "Roadside",
      "formats": [
        {
          "id": "board",
          "pixels": [
            1000,
            500
          ],
          "media": {
            "static": [
              "image/png"
            ],
            "motion": [
              "video/mp4"
            ],
            "slot_s": 10,
            "fps": 25
          },
          "physical_mm": [
            10000,
            5000
          ]
        }
      ],
      "screens": [
        {
          "id": "R1",
          "format": "board",
          "placement": {
            "environment": "outdoor",
            "faces_road": true,
            "speed_kmh": 80,
            "luminance_zone": "zone_2"
          },
          "viewing": {
            "distance_m": [
              20,
              150
            ]
          }
        }
      ],
      "rules": {
        "rule_packs": [
          "au-nsw-transport-corridor@2017-11"
        ]
      }
    }
  ]
}
