{
  "opencrs": "0.1",
  "publisher": "conf.example",
  "updated_at": "2026-10-20T09:00:00+11:00",
  "expires_at": "2027-06-30T00:00:00+10:00",
  "networks": [
    {
      "id": "n",
      "name": "Strictest network",
      "formats": [
        {
          "id": "f",
          "pixels": [
            1000,
            2000
          ],
          "physical_mm": [
            1000,
            2000
          ],
          "media": {
            "static": [
              "image/png"
            ],
            "max_bytes": 1000
          },
          "rules": {
            "required_elements": [
              {
                "role": "legal",
                "min_cap_height_mm": 12
              },
              {
                "role": "promo",
                "when": "offer",
                "min_cap_height_mm": 30,
                "within_rect_px": [
                  0,
                  0,
                  600,
                  600
                ]
              }
            ]
          }
        }
      ],
      "screens": [
        {
          "id": "A",
          "format": "f"
        },
        {
          "id": "B",
          "format": "f",
          "overrides": {
            "physical_mm": [
              500,
              1000
            ]
          },
          "rules": {
            "required_elements": [
              {
                "role": "legal",
                "when": "alcohol",
                "min_cap_height_mm": 20
              },
              {
                "role": "promo",
                "when": "offer",
                "within_rect_px": [
                  300,
                  300,
                  600,
                  600
                ]
              }
            ]
          }
        }
      ]
    }
  ]
}
