{
  "opencrs": "0.1",
  "publisher": "conf.example",
  "updated_at": "2026-10-20T09:00:00+11:00",
  "expires_at": "2027-06-30T00:00:00+10:00",
  "networks": [
    {
      "id": "n",
      "name": "Strictest network",
      "formats": [
        {
          "id": "f",
          "pixels": [
            1000,
            2000
          ],
          "physical_mm": [
            1000,
            2000
          ],
          "media": {
            "static": [
              "image/png"
            ],
            "max_bytes": 1000
          },
          "rules": {
            "legibility": {
              "ratio": 100
            },
            "required_elements": [
              {
                "role": "logo",
                "min_cap_height_mm": 20
              }
            ]
          }
        }
      ],
      "screens": [
        {
          "id": "A",
          "format": "f",
          "viewing": {
            "distance_m": [
              1,
              4
            ]
          }
        },
        {
          "id": "B",
          "format": "f",
          "viewing": {
            "distance_m": [
              2,
              8
            ]
          }
        },
        {
          "id": "C",
          "format": "f",
          "viewing": {
            "distance_m": [
              1.5,
              5
            ]
          },
          "overrides": {
            "physical_mm": [
              500,
              1000
            ]
          }
        }
      ]
    }
  ]
}
